{
  "schema_version": "1",
  "tool_id": "tokei",
  "kind": "external_binary",
  "display_name": "Tokei",
  "summary": "Fast multi-language source-lines-of-code counter. Use when `quality` needs an honest SLOC inventory that separates code, comments, and blanks instead of treating raw `splitlines()` totals as code size.",
  "upstream_repo": "XAMPPRocky/tokei",
  "homepage": "https://github.com/XAMPPRocky/tokei",
  "platforms": [
    "linux",
    "macos",
    "windows"
  ],
  "status": "active",
  "lifecycle": {
    "install": {
      "mode": "script",
      "commands": [
        "if command -v cargo >/dev/null 2>&1; then cargo install tokei; else echo 'Install tokei from https://github.com/XAMPPRocky/tokei#installation'; exit 1; fi"
      ],
      "docs_url": "https://github.com/XAMPPRocky/tokei#installation",
      "install_url": "https://github.com/XAMPPRocky/tokei#installation",
      "notes": [
        "Prefer `cargo install tokei` when Rust is already on the machine; otherwise download a release binary from the upstream repo.",
        "After installation, ensure the install bin directory is on PATH and verify with `tokei --version` before trusting any quality SLOC inventory output."
      ]
    },
    "update": {
      "mode": "script",
      "commands": [
        "if command -v cargo >/dev/null 2>&1; then cargo install tokei --force; else echo 'Update tokei from https://github.com/XAMPPRocky/tokei#installation'; exit 1; fi"
      ],
      "docs_url": "https://github.com/XAMPPRocky/tokei/releases",
      "notes": [
        "Update through the same mechanism that originally installed the binary; for cargo installs, run `cargo install tokei --force`."
      ]
    }
  },
  "checks": {
    "detect": {
      "commands": [
        "tokei --version"
      ],
      "success_criteria": [
        "exit_code:0",
        "stdout_contains:tokei"
      ],
      "failure_hint": "Install `tokei` before running the SLOC inventory advisory; do not report `splitlines()` totals as if they were code-line measurements."
    },
    "healthcheck": {
      "commands": [
        "tokei --help"
      ],
      "success_criteria": [
        "exit_code:0",
        "stdout_contains:Usage"
      ],
      "failure_hint": "The `tokei` binary exists but its help surface is not healthy. Reinstall or upgrade `tokei`, then rerun the SLOC inventory."
    }
  },
  "access_modes": [
    "binary",
    "degraded"
  ],
  "version_expectation": {
    "policy": "advisory",
    "constraint": "Prefer a recent upstream-supported tokei release.",
    "detected_by": "stdout"
  },
  "package_managers": {
    "cargo": {
      "package_name": "tokei",
      "notes": [
        "Upstream documents `cargo install tokei` as the canonical Rust install path."
      ]
    }
  },
  "supports_public_skills": [
    "quality"
  ],
  "intent_triggers": [
    "sloc",
    "source lines of code",
    "lines of code",
    "tokei",
    "code count",
    "sloc inventory",
    "language inventory"
  ],
  "recommendation_role": "validation",
  "degradation": {
    "when_missing": [
      "Multi-language SLOC inventory and repo Python length gates cannot run without `tokei`; install the binary instead of substituting physical `splitlines()` totals.",
      "Quality must not claim SLOC-based ratio or size measurements without `tokei`; report the inventory as not-run instead of substituting `splitlines()` totals."
    ],
    "when_version_mismatch": [
      "Treat unfamiliar language detection or output schema changes as a manual review point before promoting tokei findings into a hard gate."
    ]
  },
  "host_notes": [
    "Tokei is a quality validation support binary: it is discovered and installed through the external integration manifest, then consumed by quality SLOC inventory, Python length gates, and test-ratio probes when that evidence is needed.",
    "`check_python_lengths.py` uses `tokei` Python code-line counts for file/headroom limits and fails closed when the binary or output schema is unavailable. `check_test_production_ratio.py` still defaults to its splitlines engine unless `--engine tokei` is requested."
  ]
}
